{"$schema":"https://json-schema.org/draft/2020-12/schema","$id":"https://example.invalid/edu-circuit/circuit-document.schema.json","title":"CircuitDocument v7","type":"object","required":["format","version","documentId","title","components","wires","junctions","annotations","referenceNode","activity"],"properties":{"$schema":{"type":"string"},"format":{"const":"edu-circuit"},"version":{"const":7},"documentId":{"type":"string","minLength":1},"title":{"type":"string"},"components":{"type":"array","items":{"type":"object","required":["id","type","label","position","rotation","properties","terminals"],"properties":{"id":{"type":"string","minLength":1},"type":{"enum":["dc-voltage-source","resistor","switch","ammeter","voltmeter","resistive-load","diode","capacitor"]},"label":{"type":"string"},"position":{"type":"object","required":["x","y"],"properties":{"x":{"type":"number"},"y":{"type":"number"}},"additionalProperties":false},"rotation":{"enum":[0,90,180,270]},"properties":{"type":"object","additionalProperties":{"type":["number","string","boolean"]},"properties":{"voltageV":{"type":"object","required":["numerator","denominator"],"properties":{"numerator":{"type":"string","pattern":"^(0|-?[1-9][0-9]*)$"},"denominator":{"type":"string","pattern":"^[1-9][0-9]*$"}},"additionalProperties":false},"resistanceOhm":{"type":"object","required":["numerator","denominator"],"properties":{"numerator":{"type":"string","pattern":"^(0|-?[1-9][0-9]*)$"},"denominator":{"type":"string","pattern":"^[1-9][0-9]*$"}},"additionalProperties":false},"resistanceMinOhm":{"type":"object","required":["numerator","denominator"],"properties":{"numerator":{"type":"string","pattern":"^(0|-?[1-9][0-9]*)$"},"denominator":{"type":"string","pattern":"^[1-9][0-9]*$"}},"additionalProperties":false},"resistanceMaxOhm":{"type":"object","required":["numerator","denominator"],"properties":{"numerator":{"type":"string","pattern":"^(0|-?[1-9][0-9]*)$"},"denominator":{"type":"string","pattern":"^[1-9][0-9]*$"}},"additionalProperties":false},"sourceResistanceOhm":{"type":"object","required":["numerator","denominator"],"properties":{"numerator":{"type":"string","pattern":"^(0|-?[1-9][0-9]*)$"},"denominator":{"type":"string","pattern":"^[1-9][0-9]*$"}},"additionalProperties":false},"diodeThresholdV":{"type":"object","required":["numerator","denominator"],"properties":{"numerator":{"type":"string","pattern":"^(0|-?[1-9][0-9]*)$"},"denominator":{"type":"string","pattern":"^[1-9][0-9]*$"}},"additionalProperties":false},"diodeOnResistanceOhm":{"type":"object","required":["numerator","denominator"],"properties":{"numerator":{"type":"string","pattern":"^(0|-?[1-9][0-9]*)$"},"denominator":{"type":"string","pattern":"^[1-9][0-9]*$"}},"additionalProperties":false},"voltageMinV":{"type":"object","required":["numerator","denominator"],"properties":{"numerator":{"type":"string","pattern":"^(0|-?[1-9][0-9]*)$"},"denominator":{"type":"string","pattern":"^[1-9][0-9]*$"}},"additionalProperties":false},"voltageMaxV":{"type":"object","required":["numerator","denominator"],"properties":{"numerator":{"type":"string","pattern":"^(0|-?[1-9][0-9]*)$"},"denominator":{"type":"string","pattern":"^[1-9][0-9]*$"}},"additionalProperties":false},"capacitanceF":{"type":"object","required":["numerator","denominator"],"properties":{"numerator":{"type":"string","pattern":"^(0|-?[1-9][0-9]*)$"},"denominator":{"type":"string","pattern":"^[1-9][0-9]*$"}},"additionalProperties":false},"initialVoltageV":{"type":"object","required":["numerator","denominator"],"properties":{"numerator":{"type":"string","pattern":"^(0|-?[1-9][0-9]*)$"},"denominator":{"type":"string","pattern":"^[1-9][0-9]*$"}},"additionalProperties":false}}},"terminals":{"type":"array","minItems":2,"items":{"type":"object","required":["id","role"],"properties":{"id":{"type":"string","minLength":1},"role":{"type":"string","minLength":1},"localPosition":{"type":"object","required":["x","y"],"properties":{"x":{"type":"number"},"y":{"type":"number"}},"additionalProperties":false}},"additionalProperties":false}},"operatingProfile":{"type":"object","required":["id","revision"],"properties":{"id":{"enum":["edu-source","edu-diode","edu-diode-signal","edu-diode-power","edu-resistor"]},"revision":{"const":1}},"additionalProperties":false}},"additionalProperties":false,"allOf":[{"if":{"properties":{"type":{"const":"diode"}},"required":["type"]},"then":{"properties":{"terminals":{"minItems":2,"maxItems":2,"allOf":[{"contains":{"properties":{"role":{"const":"anode"}},"required":["role"]}},{"contains":{"properties":{"role":{"const":"cathode"}},"required":["role"]}}]}}}},{"if":{"properties":{"type":{"const":"capacitor"}},"required":["type"]},"then":{"properties":{"properties":{"type":"object","required":["capacitanceF","initialVoltageV"],"properties":{"capacitanceF":{"type":"object","required":["numerator","denominator"],"properties":{"numerator":{"type":"string","pattern":"^(0|-?[1-9][0-9]*)$"},"denominator":{"type":"string","pattern":"^[1-9][0-9]*$"}},"additionalProperties":false},"initialVoltageV":{"type":"object","required":["numerator","denominator"],"properties":{"numerator":{"type":"string","pattern":"^(0|-?[1-9][0-9]*)$"},"denominator":{"type":"string","pattern":"^[1-9][0-9]*$"}},"additionalProperties":false},"quantityMode":{"enum":["auto","scientific","plain"]},"capacitanceFFraction":{"type":"string"},"initialVoltageVFraction":{"type":"string"}},"patternProperties":{"^(label|answer|voltage|current)(Visible|Blank)$":{"type":"boolean"},"^(label|answer|voltage|current)Offset[XY]$":{"type":"number"}},"additionalProperties":false},"terminals":{"minItems":2,"maxItems":2,"allOf":[{"contains":{"properties":{"role":{"const":"a"}},"required":["role"]}},{"contains":{"properties":{"role":{"const":"b"}},"required":["role"]}}]}},"not":{"required":["operatingProfile"]}},"else":{"properties":{"properties":{"not":{"anyOf":[{"required":["capacitanceF"]},{"required":["initialVoltageV"]}]}}}}}]}},"wires":{"type":"array","items":{"type":"object","required":["id","start","end","waypoints"],"properties":{"id":{"type":"string","minLength":1},"start":{"type":"object","required":["kind","id"],"properties":{"kind":{"enum":["terminal","junction"]},"id":{"type":"string","minLength":1}},"additionalProperties":false},"end":{"type":"object","required":["kind","id"],"properties":{"kind":{"enum":["terminal","junction"]},"id":{"type":"string","minLength":1}},"additionalProperties":false},"waypoints":{"type":"array","items":{"type":"object","required":["x","y"],"properties":{"x":{"type":"number"},"y":{"type":"number"}},"additionalProperties":false}}},"additionalProperties":false}},"junctions":{"type":"array","items":{"type":"object","required":["id","position"],"properties":{"id":{"type":"string","minLength":1},"position":{"type":"object","required":["x","y"],"properties":{"x":{"type":"number"},"y":{"type":"number"}},"additionalProperties":false}},"additionalProperties":false}},"annotations":{"type":"array","items":{"type":"object","required":["id","kind","anchor","content","visibility"],"properties":{"id":{"type":"string"},"kind":{"enum":["label","arrow","blank","question","note","point"]},"anchor":{"oneOf":[{"type":"object","required":["kind","id"],"properties":{"kind":{"enum":["terminal","junction"]},"id":{"type":"string","minLength":1}},"additionalProperties":false},{"type":"null"}]},"content":{"type":"string"},"visibility":{"enum":["always","hidden"]},"position":{"type":"object","required":["x","y"],"properties":{"x":{"type":"number"},"y":{"type":"number"}},"additionalProperties":false},"end":{"type":"object","required":["x","y"],"properties":{"x":{"type":"number"},"y":{"type":"number"}},"additionalProperties":false},"arrow":{"type":"object","required":["shape","length","legLength","rotation","reversed"],"properties":{"shape":{"enum":["straight","corner"]},"length":{"type":"number","minimum":0},"legLength":{"type":"number","minimum":0},"rotation":{"type":"number"},"reversed":{"type":"boolean"}},"additionalProperties":false},"presentation":{"type":"object","additionalProperties":{"type":["string","number","boolean"]}}},"additionalProperties":false}},"referenceNode":{"oneOf":[{"type":"object","required":["kind","id"],"properties":{"kind":{"enum":["terminal","junction"]},"id":{"type":"string","minLength":1}},"additionalProperties":false},{"type":"null"}]},"activity":{"oneOf":[{"type":"null"},{"type":"object","required":["allowedCommands","revealSteps"],"properties":{"allowedCommands":{"type":"array","items":{"type":"string"},"uniqueItems":true},"revealSteps":{"type":"array","items":{"type":"object"}},"resetSnapshotId":{"type":["string","null"]}},"additionalProperties":true}]},"output":{"type":"object","properties":{"fontScale":{"type":"number","minimum":0.5,"maximum":2}},"additionalProperties":false}},"additionalProperties":false}
